{
  "id": "financial-modeling-prep",
  "base_url": "https://financialmodelingprep.com/stable",
  "docs_url": "https://site.financialmodelingprep.com/developer/docs",
  "auth_type": "apiKey",
  "auth_details": "API key via query parameter apikey=YOUR_API_KEY (self-serve signup). Some endpoints may also accept the key in headers \u2014 verify current docs.",
  "free_tier": true,
  "free_tier_limits": "250 API calls/day on Free plan; limited free endpoints (not full API)",
  "paid_plans": null,
  "rate_limits": "Published by plan: Free 250/day; Starter 300/min; Premium 750/min; Ultimate 3000/min",
  "cors": "unknown",
  "example_request": "curl \"https://financialmodelingprep.com/stable/quote?symbol=AAPL&apikey=YOUR_API_KEY\"",
  "example_response_snippet": "[{\"symbol\":\"AAPL\",\"name\":\"Apple Inc.\",\"price\":178.72,\"changePercentage\":0.5,\"change\":0.89,\"dayLow\":177.5,\"dayHigh\":179.2,\"yearHigh\":199.62,\"yearLow\":164.08,\"marketCap\":2800000000000,\"volume\":52000000,\"avgVolume\":55000000,\"exchange\":\"NASDAQ\",\"open\":178.0,\"previousClose\":177.83,\"eps\":6.13,\"pe\":29.15,\"earningsAnnouncement\":null,\"sharesOutstanding\":15550000000,\"timestamp\":1710000000}]",
  "description": "Financial Modeling Prep (FMP) provides REST APIs for stock prices, company financials, ratios, market news, and related market data used in investment research and financial applications.",
  "status": "operational",
  "resolution_notes": "Auditor right on response schema. Official /stable/quote docs (https://site.financialmodelingprep.com/developer/docs#quote) document changePercentage, not changesPercentage; field set matches current stable response. Corrected snippet uses changePercentage."
}