{
  "id": "censys",
  "base_url": "https://api.platform.censys.io",
  "docs_url": "https://docs.censys.com/reference/get-started",
  "auth_type": "apiKey",
  "auth_details": "API ID and Secret via Basic Auth or headers, self-serve signup",
  "free_tier": true,
  "free_tier_limits": "Free: 100 credits/mo (expire monthly); Free API limited to host/web-property/certificate lookups (1 credit each); standard search 5 credits; concurrent limit 1",
  "paid_plans": null,
  "rate_limits": "By tier concurrent actions: Free/Starter 1; Search/Core 25. Full limits shown on Platform Personal Access Tokens page; API calls consume credits",
  "cors": "unknown",
  "example_request": "curl --request GET --url 'https://api.platform.censys.io/v3/global/asset/host/8.8.8.8' --header 'Accept: application/vnd.censys.api.v3.host.v1+json' --header 'Authorization: Bearer YOUR_PAT'",
  "example_response_snippet": "{\"result\":{\"resource\":{\"ip\":\"8.8.8.8\",\"location\":{\"country\":\"United States\",\"country_code\":\"US\"},\"services\":[{\"port\":53,\"protocol\":\"DNS\",\"transport_protocol\":\"udp\"}],\"service_count\":1}}}",
  "description": "Censys provides internet-wide scan data covering hosts, certificates, and services for attack-surface research and security analysis. The API enables searching and retrieving detailed information about internet-connected assets.",
  "status": "operational",
  "resolution_notes": "Pending live verification of base_url and auth disputes."
}