{
  "id": "fatsecret",
  "base_url": null,
  "docs_url": null,
  "auth_type": null,
  "auth_details": null,
  "free_tier": null,
  "free_tier_limits": "5,000 API calls/day; US-only data; attribution required",
  "paid_plans": null,
  "rate_limits": "Basic: 5,000 API calls/day; Premier tiers: unlimited API calls",
  "cors": null,
  "example_request": "curl -s 'https://platform.fatsecret.com/rest/foods/search/v1?search_expression=apple&format=json' -H 'Authorization: Bearer YOUR_ACCESS_TOKEN'\n# Token: POST https://oauth.fatsecret.com/connect/token (client_credentials)",
  "example_response_snippet": null,
  "description": null,
  "status": null,
  "resolution_notes": "free_tier_limits: auditor right \u2014 Basic 5k/day, US-only, attribution (platform.fatsecret.com). rate_limits: auditor right \u2014 same Basic cap; Premier unlimited. example.request: auditor right \u2014 Bearer is OAuth access token from oauth.fatsecret.com/connect/token, not API key."
}