{
  "id": "sportmonks",
  "base_url": null,
  "docs_url": null,
  "auth_type": null,
  "auth_details": null,
  "free_tier": null,
  "free_tier_limits": "Danish Superliga & Scottish Premiership; ~2,000 API calls per entity per hour (no-expiry free football plan)",
  "paid_plans": "Starter from \u20ac29/mo (5 leagues); Growth from \u20ac99/mo (30 leagues); Pro from \u20ac249/mo (120 leagues); Enterprise custom; 14-day trial on paid plans",
  "rate_limits": "Starter: 2,000; Growth: 2,500; Pro: 3,000; Enterprise: 5,000 API calls per entity per hour (add-ons can increase)",
  "cors": null,
  "example_request": null,
  "example_response_snippet": null,
  "description": null,
  "status": null,
  "resolution_notes": "Auditor correct on all three. free_tier_limits: Free Plan (no expiry) covers Danish Superliga + Scottish Premiership and uses Free-plan rate limits (~2k calls/entity/hour per rate-limits docs) \u2014 https://www.sportmonks.com/football-api/ and https://docs.sportmonks.com/football/welcome/rate-limit. paid_plans: Official pricing lists Starter \u20ac29 (5 leagues), Growth \u20ac99 (30), Pro \u20ac249 (120), Enterprise custom; 14-day free trial on paid \u2014 https://www.sportmonks.com/football-api/. rate_limits: Published per plan (Starter 2000, Growth 2500, Pro 3000, Enterprise 5000 per entity/hour; add-ons available) \u2014 https://docs.sportmonks.com/football/welcome/rate-limit and https://www.sportmonks.com/football-api/."
}