{
  "id": "newscatcher",
  "base_url": "https://v3-api.newscatcherapi.com",
  "docs_url": "https://docs.newscatcherapi.com",
  "auth_type": "apiKey",
  "auth_details": "API key authentication; exact header and signup flow need official docs confirmation.",
  "free_tier": true,
  "free_tier_limits": "14-day trial: 50 requests/day, 1 request/second; no permanent free tier (confirm on pricing page)",
  "paid_plans": null,
  "rate_limits": "Plan-dependent (e.g. Trial 1 rps / 50 req/day; higher tiers publish RPS and monthly call quotas on pricing)",
  "cors": "unknown",
  "example_request": "curl -X GET \"https://v3-api.newscatcherapi.com/api/search?q=Microsoft&lang=en\" -H \"x-api-token: YOUR_API_KEY\"",
  "example_response_snippet": "{\"status\":\"ok\",\"total_hits\":0,\"page\":1,\"page_size\":100,\"articles\":[]}",
  "description": "NewsCatcher provides programmatic access to news articles, headlines, and media sources. Used for media monitoring, news aggregation, and research workflows. This entry needs verification against official 2026 docs for base URL, auth, pricing, and rate limits.",
  "status": "operational",
  "resolution_notes": "Pending live verification of auditor disputes against official NewsCatcher docs."
}