{
  "id": "amtrak-statusmaps",
  "base_url": null,
  "docs_url": null,
  "auth_type": null,
  "auth_details": null,
  "free_tier": null,
  "free_tier_limits": null,
  "paid_plans": null,
  "rate_limits": null,
  "cors": null,
  "example_request": null,
  "example_response_snippet": null,
  "description": null,
  "status": null,
  "resolution_notes": "Pending live verification of disputed example endpoint vs getTrainsData and payload format."
}