{
  "id": "themealdb",
  "base_url": null,
  "docs_url": null,
  "auth_type": null,
  "auth_details": null,
  "free_tier": null,
  "free_tier_limits": null,
  "paid_plans": null,
  "rate_limits": null,
  "cors": null,
  "example_request": null,
  "example_response_snippet": null,
  "description": null,
  "status": null,
  "resolution_notes": "Auditor was correct on pricing mix-up: official API page (https://www.themealdb.com/api.php) advertises a \u00a310 lifetime PayPal upgrade for full API access; the older FAQ still references Patreon. Free test key \"1\" remains for development. Corrected free_tier_limits and paid_plans to reflect current PayPal lifetime model while noting legacy FAQ Patreon language."
}