{
  "id": "vesselfinder",
  "base_url": null,
  "docs_url": null,
  "auth_type": null,
  "auth_details": "API key supplied through the required userkey query parameter.",
  "free_tier": null,
  "free_tier_limits": null,
  "paid_plans": "Credit packs: 10,000 credits EUR 330; 20,000 EUR 625; 50,000 EUR 1,470 (12-month validity, excl. VAT). VesselsList and LiveData use separately quoted fixed subscriptions.",
  "rate_limits": null,
  "cors": null,
  "example_request": null,
  "example_response_snippet": "[{\"AIS\":{\"MMSI\":123456789,\"NAME\":\"EXAMPLE SHIP\",\"IMO\":0,\"CALLSIGN\":\"\",\"TIMESTAMP\":\"2017-08-11 11:17:37 UTC\",\"LATITUDE\":0.0,\"LONGITUDE\":0.0,\"COURSE\":0.0,\"SPEED\":0.0,\"HEADING\":0,\"NAVSTAT\":0,\"TYPE\":70,\"A\":0,\"B\":0,\"C\":0,\"D\":0,\"DRAUGHT\":0.0,\"DESTINATION\":\"\",\"ETA_AIS\":\"00-00 00:00\"}}]",
  "description": null,
  "status": null,
  "resolution_notes": "auth.details: auditor right \u2014 docs require userkey query param (https://api.vesselfinder.com/docs/vesselslist.html). paid_plans: auditor right \u2014 credit packs 10k/330, 20k/625, 50k/1470 EUR; VesselsList/LiveData fixed fee (https://api.vesselfinder.com/, https://www.vesselfinder.com/vessel-positions-api). response_snippet: auditor right \u2014 TIMESTAMP is \"YYYY-MM-DD HH:MM:SS UTC\" not ISO-8601 (https://api.vesselfinder.com/docs/vesselslist.html)."
}